{
  "$schema": "http://json-schema.org/draft-07/schema#",
  "title": "passage_bank_supplement 补充语篇库 Schema",
  "type": "array",
  "items": {
    "type": "object",
    "required": [
      "id",
      "text",
      "provenance"
    ],
    "properties": {
      "id": {
        "type": "string"
      },
      "lesson": {
        "type": [
          "number",
          "string"
        ]
      },
      "student": {
        "type": "string"
      },
      "tier": {
        "type": "string"
      },
      "source_type": {
        "type": "string"
      },
      "provenance": {
        "type": "string"
      },
      "genre": {
        "type": "string"
      },
      "difficulty": {
        "type": "string"
      },
      "word_count": {
        "type": "number"
      },
      "vocab_rate": {},
      "vocab_rate_note": {
        "type": "string"
      },
      "theme": {
        "type": "string"
      },
      "grammar_focus": {},
      "text": {
        "type": "string"
      },
      "questions": {}
    }
  }
}