[
 {
  "id": "XYJ2026_L04_reading_a",
  "lesson": 4,
  "student": "许颖嘉",
  "tier": "基础",
  "source_type": "original",
  "provenance": "原创语篇 · AI 编写（教师 2026-08-02 授权自行开发高质量语库）；主题/语法对齐人教版七下对应单元；非真题改编，生词率按 M2 词汇库实测",
  "genre": "记叙文",
  "difficulty": "易",
  "word_count": 118,
  "vocab_rate": "89%",
  "vocab_rate_note": "生词率按目标词库 vocab_bank + 基础已知词表 base_vocab（M2b，2026-08-02 扩充）实测；语篇难度为七下基础常用词，目标 70% 熟词 / 30% 生词。",
  "theme": "房间与方位",
  "grammar_focus": [
   "名词复数",
   "方位介词",
   "tidy"
  ],
  "text": "Hello! My name is Lucy. I have a small but tidy room. There is a bed, a desk and a chair in it. On the wall, there are two maps and three photos. Under the desk, there is a big box. My books are in the box. Some are on the shelf, and some are on the desk. My clothes are in the wardrobe. My schoolbag is on the chair. Look at the table! There are some cups, two glasses and a plant on it. Between the bed and the desk, there is a lamp. Behind the door, there is a ball. My room is small, but it is clean and tidy. I like my room very much.",
  "questions": [
   {
    "num": 1,
    "q": "How many photos are on the wall?",
    "opts": [
     [
      "A",
      "two"
     ],
     [
      "B",
      "three"
     ],
     [
      "C",
      "five"
     ]
    ],
    "answer": "B"
   },
   {
    "num": 2,
    "q": "Where is the big box?",
    "opts": [
     [
      "A",
      "on the desk"
     ],
     [
      "B",
      "under the desk"
     ],
     [
      "C",
      "on the shelf"
     ]
    ],
    "answer": "B"
   },
   {
    "num": 3,
    "q": "What is between the bed and the desk?",
    "opts": [
     [
      "A",
      "a plant"
     ],
     [
      "B",
      "a ball"
     ],
     [
      "C",
      "a lamp"
     ]
    ],
    "answer": "C"
   },
   {
    "num": 4,
    "q": "Where is the ball?",
    "opts": [
     [
      "A",
      "behind the door"
     ],
     [
      "B",
      "in the wardrobe"
     ],
     [
      "C",
      "under the chair"
     ]
    ],
    "answer": "A"
   },
   {
    "num": 5,
    "q": "Which word is the plural of 'box'?",
    "opts": [
     [
      "A",
      "boxs"
     ],
     [
      "B",
      "boxes"
     ],
     [
      "C",
      "boxies"
     ]
    ],
    "answer": "B"
   }
  ]
 },
 {
  "id": "XYJ2026_L04_reading_b",
  "lesson": 4,
  "student": "许颖嘉",
  "tier": "基础",
  "source_type": "original",
  "provenance": "原创语篇 · AI 编写（教师 2026-08-02 授权自行开发高质量语库）；主题/语法对齐人教版七下对应单元；非真题改编，生词率按 M2 词汇库实测",
  "genre": "记叙文",
  "difficulty": "易",
  "word_count": 117,
  "vocab_rate": "85%",
  "vocab_rate_note": "生词率按目标词库 vocab_bank + 基础已知词表 base_vocab（M2b，2026-08-02 扩充）实测；语篇难度为七下基础常用词，目标 70% 熟词 / 30% 生词。",
  "theme": "房间与方位",
  "grammar_focus": [
   "方位介词",
   "Where 问句"
  ],
  "text": "It is Sunday morning. Mike wants to play football, but he cannot find his ball. \"Where is my ball?\" he asks. \"Is it under your bed?\" his mother asks. Mike looks under the bed. No ball there. \"Is it behind the door?\" his father asks. Mike looks behind the door. No ball there. \"Is it in the box?\" his sister asks. Mike looks in the box. No ball there. He is sad. Then his little brother comes in. \"Look, Mike! Your ball is on the table, between two cups,\" he says. Mike runs to the table and finds his ball. \"Thank you, little brother!\" Mike is happy again. They go to the park and play football together.",
  "questions": [
   {
    "num": 1,
    "q": "When does the story happen?",
    "opts": [
     [
      "A",
      "Sunday morning"
     ],
     [
      "B",
      "Friday night"
     ],
     [
      "C",
      "Monday morning"
     ]
    ],
    "answer": "A"
   },
   {
    "num": 2,
    "q": "What does Mike want to do?",
    "opts": [
     [
      "A",
      "play football"
     ],
     [
      "B",
      "read a book"
     ],
     [
      "C",
      "play basketball"
     ]
    ],
    "answer": "A"
   },
   {
    "num": 3,
    "q": "Where is the ball at last?",
    "opts": [
     [
      "A",
      "under the bed"
     ],
     [
      "B",
      "on the table"
     ],
     [
      "C",
      "behind the door"
     ]
    ],
    "answer": "B"
   },
   {
    "num": 4,
    "q": "Who helps Mike find the ball?",
    "opts": [
     [
      "A",
      "his father"
     ],
     [
      "B",
      "his mother"
     ],
     [
      "C",
      "his brother"
     ]
    ],
    "answer": "C"
   },
   {
    "num": 5,
    "q": "How does Mike feel at the end?",
    "opts": [
     [
      "A",
      "sad"
     ],
     [
      "B",
      "happy"
     ],
     [
      "C",
      "angry"
     ]
    ],
    "answer": "B"
   }
  ]
 },
 {
  "id": "XYJ2026_L05_reading_a",
  "lesson": 5,
  "student": "许颖嘉",
  "tier": "基础",
  "source_type": "original",
  "provenance": "原创语篇 · AI 编写（教师 2026-08-02 授权自行开发高质量语库）；主题/语法对齐人教版七下对应单元；非真题改编，生词率按 M2 词汇库实测",
  "genre": "记叙文",
  "difficulty": "易",
  "word_count": 102,
  "vocab_rate": "90%",
  "vocab_rate_note": "生词率按目标词库 vocab_bank + 基础已知词表 base_vocab（M2b，2026-08-02 扩充）实测；语篇难度为七下基础常用词，目标 70% 熟词 / 30% 生词。",
  "theme": "食物与日常",
  "grammar_focus": [
   "祈使句",
   "What 问句",
   "like"
  ],
  "text": "Lily is a student. She has good eating habits. Every morning, she has milk and bread for breakfast. \"What do you like for breakfast?\" her mother asks. \"I like milk and bread,\" Lily answers. For lunch, she has rice, vegetables and chicken at school. In the evening, her family eat apples, bananas and oranges after dinner. Lily drinks water every day. She says, \"Drink water, not cola! It is good for you.\" She does not like fast food. \"Don't eat too much fast food,\" she often says. Fruit and milk help her grow tall and strong. Lily is healthy and happy.",
  "questions": [
   {
    "num": 1,
    "q": "What does Lily have for breakfast?",
    "opts": [
     [
      "A",
      "rice and chicken"
     ],
     [
      "B",
      "milk and bread"
     ],
     [
      "C",
      "fruit and cola"
     ]
    ],
    "answer": "B"
   },
   {
    "num": 2,
    "q": "What does Lily like?",
    "opts": [
     [
      "A",
      "milk and bread"
     ],
     [
      "B",
      "fast food"
     ],
     [
      "C",
      "cola"
     ]
    ],
    "answer": "A"
   },
   {
    "num": 3,
    "q": "What does Lily drink every day?",
    "opts": [
     [
      "A",
      "cola"
     ],
     [
      "B",
      "juice"
     ],
     [
      "C",
      "water"
     ]
    ],
    "answer": "C"
   },
   {
    "num": 4,
    "q": "What does Lily say about fast food?",
    "opts": [
     [
      "A",
      "Eat it every day"
     ],
     [
      "B",
      "Don't eat too much"
     ],
     [
      "C",
      "It is good for you"
     ]
    ],
    "answer": "B"
   },
   {
    "num": 5,
    "q": "What helps Lily grow tall and strong?",
    "opts": [
     [
      "A",
      "fast food and cola"
     ],
     [
      "B",
      "fruit and milk"
     ],
     [
      "C",
      "candy and cakes"
     ]
    ],
    "answer": "B"
   }
  ]
 },
 {
  "id": "XYJ2026_L05_reading_b",
  "lesson": 5,
  "student": "许颖嘉",
  "tier": "基础",
  "source_type": "original",
  "provenance": "原创语篇 · AI 编写（教师 2026-08-02 授权自行开发高质量语库）；主题/语法对齐人教版七下对应单元；非真题改编，生词率按 M2 词汇库实测",
  "genre": "记叙文",
  "difficulty": "易",
  "word_count": 105,
  "vocab_rate": "86%",
  "vocab_rate_note": "生词率按目标词库 vocab_bank + 基础已知词表 base_vocab（M2b，2026-08-02 扩充）实测；语篇难度为七下基础常用词，目标 70% 熟词 / 30% 生词。",
  "theme": "食物与日常",
  "grammar_focus": [
   "like",
   "祈使句"
  ],
  "text": "Sam gets up at seven on Sunday. He is hungry. He wants a big breakfast. \"What do you have for breakfast?\" his mother asks. \"I like eggs and bread,\" Sam says. Mother says, \"Please wash your hands first.\" Sam washes his hands. Then he eats two eggs and some bread. He also drinks a glass of milk. After breakfast, his mother says, \"Don't forget to brush your teeth.\" Sam brushes his teeth. Now Sam is full. \"What do you like for lunch?\" his mother asks. Sam smiles. \"I like rice and chicken. And I like oranges after lunch!\" he answers. What a happy Sunday!",
  "questions": [
   {
    "num": 1,
    "q": "When does Sam get up?",
    "opts": [
     [
      "A",
      "at six"
     ],
     [
      "B",
      "at seven"
     ],
     [
      "C",
      "at eight"
     ]
    ],
    "answer": "B"
   },
   {
    "num": 2,
    "q": "What does Sam like for breakfast?",
    "opts": [
     [
      "A",
      "eggs and bread"
     ],
     [
      "B",
      "rice and chicken"
     ],
     [
      "C",
      "fruit"
     ]
    ],
    "answer": "A"
   },
   {
    "num": 3,
    "q": "What does mother ask Sam to do first?",
    "opts": [
     [
      "A",
      "brush teeth"
     ],
     [
      "B",
      "wash hands"
     ],
     [
      "C",
      "drink milk"
     ]
    ],
    "answer": "B"
   },
   {
    "num": 4,
    "q": "What does Sam drink?",
    "opts": [
     [
      "A",
      "a glass of milk"
     ],
     [
      "B",
      "a cup of cola"
     ],
     [
      "C",
      "a cup of tea"
     ]
    ],
    "answer": "A"
   },
   {
    "num": 5,
    "q": "What does Sam like for lunch?",
    "opts": [
     [
      "A",
      "eggs and bread"
     ],
     [
      "B",
      "rice and chicken"
     ],
     [
      "C",
      "milk and bread"
     ]
    ],
    "answer": "B"
   }
  ]
 },
 {
  "id": "XYJ2026_L07_reading_a",
  "lesson": 7,
  "student": "许颖嘉",
  "tier": "基础",
  "source_type": "original",
  "provenance": "原创语篇 · AI 编写（教师 2026-08-02 授权自行开发高质量语库）；主题/语法对齐人教版七下对应单元；非真题改编，生词率按 M2 词汇库实测",
  "genre": "记叙文",
  "difficulty": "易",
  "word_count": 111,
  "vocab_rate": "88%",
  "vocab_rate_note": "生词率按目标词库 vocab_bank + 基础已知词表 base_vocab（M2b，2026-08-02 扩充）实测；语篇难度为七下基础常用词，目标 70% 熟词 / 30% 生词。",
  "theme": "复习综合（L1–L6）",
  "grammar_focus": [
   "be 动词",
   "人称代词",
   "食物",
   "一般现在时"
  ],